timestamp,words,tags
,"The kids thought it was funny when Teruko Ikeda or I said “yes, sir” or “no, sir” to a teacher. This shows how much they are mistacken [sic], & not us. Pupils aren’t so co-operative as the ones back in B.C. schools and they think that their school is of a high standard, but not to me. Our building has only two floors, while the Public building has four floors. You see, Joan, High School & Public School are separate buildings. On the whole, public building is larger. Both buildings are made of brick.",Education; Homesickness
,For 3 months school starts at 9:30 A.M. because it is so dark in the morning around 9:00 A.M. Lunch is from 12:15 P.M to 1:30 P.M. School begins again in the afternoon at 1:30 P.M. until 4:00 P.M. but there is a ten minute afternoon recess.,Education
,"For a month, since we started, we walked to school until December 1, the van from the cheese factory began to run. In the mornings, the van isn’t so crowded as in night because the driver makes 2 trips; but at nights, he takes us all in one trip so you can just imagine how crowded it is inside! The Raymond Highway kids gets [sic] on the first trip (this is us.) and the Stirling Highway gets on the second trip. We reach school around 8:30 A.M. so we asked the principle for permission to play basketball in the mornings. The principle said “yes” so we play in the gym, which is only about 1/3 of 2.E.’s gymnasium. For P.T., girls may wear skirts, dresses, shorts, slacks, or even leather sole shoes because I do. In Lethbridge or Raymond, I went all over the shoe stores asking for girls’ white running shoes, but they don’t have anymore in stock. After P.T. everyone’s supposed to take a shower, but no one ever does, besides there isn’t any time. Well, Joan, I think I’ve talked enough about school, so I think I’d better leave the rest for the next letter.",Education; Recreation
,"The weather certainly changes quick out here. Just last week it was so cold, but now, the temp. is up to 40 degrees. The coldest has been around 20 degrees below. Out here, even if it is 30 degrees or 20 degrees below, you can’t feel it, but just to make people say “Gee, it’s cold today.” Once we walked 5 miles to school in 17 degrees below zero. It was kinda colder than most mornings we",Living-conditions
,"thought, but I didn’t imagine it would be 17 degrees below. The van didn’t run at this time yet. When we rush and walk without resting, our body is warm but our cheeks, nose, and chin are just about frozen. There are quite a number of families living at least 5 miles out of town, but I don’t there there [sic] is any family living more than six five miles.",Living-conditions
,"Almost every farmer has started threshing again since the weather is excellent. My Dad has gone threshing also, except that our owner’s thresher machine is old & gets broken easily; then my Dad has to stay around the machine & fix it everytime. He’s more of a mechanist than a wheat hauler, but he doesn’t mind as he likes the job as a mechanist better. You know, he’s so small & short, he’s able to go under the machine & fix it.",Labour-conditions
,"Our beet crop on the whole was satisfactory. It averaged around 11 ½ tons per acre, while most of the other crops yielded 9-9 ½ tons per acre. We harvested ours quite early so we did 5 acres of anothers man’s crop. If we had just finished harvesting our own crop and then went to school, I won’t be so far behind in my school-work. However, I’m getting caught up on it soon.",Beet-farms; Education
,"Joan, do you know what I got for my birthday? Guess, — first. I got a pair of black skates!! Just what I had been wishing for the last three years, and now I got my chance to get them.",Recreation
,"When I return home again, you & I would go skating to the arena or wherever there is a skating pond. (if you want me as a company.) I think that would be fun. There is a rink in Raymond town which anybody can go in free & stay, as long as they want to skate. I believe it’s open every afternoon until 10:00 P.M. and 12:00 midnight, only on Saturday nights. There is also some music playing from the girl’s changing room. There is also another rink for boy’s hockey square next to the larger skating rink. I practiced skating on Teruko’s skates on the frozen pig lake. Here’s where we go mostly afterschools [sic] because it takes just about 8 minutes’ walk, any anyways [sic] it’s Maudsleys’, so he won’t chase us out.",Recreation; Joan; Optimism
,"Well, I’ve written enough for now so I guess I had better close. It’s such a long boring letter that it’ll take at least 2 days to read it, and what a scribble! If you can’t make it out, Joan, send it right back & I’ll rewrite it over again. Perhaps that’ll teach me to be more careful.",Communications
,Hoping to hear from from you sooner than I wrote to you —,
,"Your pal as ever, Sumi.",
Letter 5,"Box 167, Raymond Alta",
,January 31/43,
,"Dearest Joan, —",
,"Hi – Joan! How are you and all the rest? Well, I hope, as we all are fine in spite of the cold weather we’re having.",
,This isn’t going to [sic] such a long letter as I believe I haven’t much to write. I admit I don’t like writing letters but somehow or rather I get it done anyways – thoughs its [sic] nothing compared to yours.,Communications
,"Thank you ever so much for your beautiful card & hankies. Honestly I’ve never dreamed of receiving such presents. And look at me, I tried to send your present in time, but lazy me, I never do get things done right away. Everybody in the house was just about practically driving me crazy saying – “When are you going to buy Joan’s present? When are you going to send it?” That’s all what I’ve been hearing in the house until last Friday I went to Lethbridge to get a picture taken for registration. (I’ll send you one if its OK.) It’s nothing much & I’m really very sorry its going to be",Joan
,"awfully late but still wishing you a “Happy Birthday, Joan, and Many Happy returns of the day!” Enclosed is also a Valentine Card. I was just wondering who the “two brides” are? Could it be “Joan & Lionel?” Please tell!!",
,"Yesterday I went to the skating rink with my sisters for a bit of fun. Really, I don’t think it was much fun. There was one particular guy who kept on pushing me & another girl who was skating with me, & every time he pushed us, well, we’ll fall! You see, Joan, I’ve been on the ice only four times and I’m nowhere an expert. If I was, well, I wouldn’t g let him get away with it. After all, he’s a way better skater than both of us. I figure it would be better if I skated on our own ice pond, but heavens! it’ll take ages to shovel all the snow off. Raymond is the only place where you can go in and skate for free. Other places charges [sic] you so much for so long, so I guess were [sic] quite fortunate.",Recreation
,We’ve had a very cold [spell] for over a week. The coldest was 50 degrees below.,Living-conditions
,"Other days were below 30 degrees below and it never went above anymore than 30 degrees below. At noon, it’ll be around 35 degrees below while at night it suddenly drops down to 45 degrees below. Our window glass was covered at least an inch with ice inside & not outside. We could’nt [sic] see anything until the ice melted, and it makes such a mess when it does melt. Nobody sits near the window as it is cold, but all crowds around the poor old stove who’s trying so hard to give off heat in spite of all its efforts. When it gets to be so cold, you can’t feel the coldness but it stings your nose and cheeks.",Living-conditions
,"We’ve had only one blizzard this year so far. And what a blizzard! You couldn’t see an inch ahead of you. We didn’t go to school that day. Quite a lot never went also. The van driver said that he started out the same time as every morning, but was at least an hour and half off the schedule.",Living-conditions
,The thermometer is up to 30 degrees above right now. It’s quite a change after those cold days. People say that this coldness is,
,"the same as the year 1935. Usually, they say that it isn’t this cold every winter. How are the things at school? Are you very busy with your homework? We hardly get homework except S.S. & French almost every night. Every gym period we play basketball. Most of the girls take P.T. in their dresses and so do I. Rules over here aren’t so very strict. Teruko’s class went ice-skating for 3 periods one afternoon twice. We planned on going last Fri. but it snowed the day before so we couldn’t skate because the snow wasn’t scraped off yet.",Education; Recreation
,"Gee, I wish you were over here or I over there, well it doesn’t make any difference as to where it is as long as were [sic] together.",Joan; Homesickness
,This writing pad is the first one I used on your letter which you gave me for Xmas. I haven’t used any envelopes yet.,
,Mother just handed me out the bunch of lavenders which was in my Xmas present from you & she wants to know if you can get hold of any more of them. She just loves the scent of it & she’ll be very grateful if you can send anymore if you can get some more.,Homesickness
,"Well I think I’ve said all I wanted to say. Best regards to you all – yours as ever,",
,Sumi M.,
Letter 6,"Box 167,",
,"Raymond, Alta.,",
,"April 24,/43.",
,Dearest Joan;,
,"“Happy Easter” to you, Joan. “Best Wishes” to you from all of us. How are you and everybody? Well, I hope, as we all are also. I am very very sorry for not writing to you sooner …. for some … ah … unfavorable circumstance! I hope I didn’t keep you waiting very long. Ahem!!!",Communications
,"Well, Joan, how is school? Fine? Well, I hope so, as I’m getting used to this “hostility.” You know, about two weeks ago snakes started to appear & some boys thought that they were smart and put a live snake into a girl’s zipper loose-leaf. She didn’t know anything about it, and when she unzipped it during the period (study period.) the snake just sprung at her & was she frightened! Poor girl, & she just can’t stand snakes. This isn’t the only incident that has happened. I saw a snake coiled on the banister and several times live snakes wandering in the rooms. Especially the Grade X room because its [sic] only the Grade X boys who would think of doing it. Well, I’m glad as the principle gave a lecture on such a behavior. Baseball game has opened up once again. We play baseball every gym period. Outdoors if the day is fine or indoors when it isn’t.",Education; Recreation
,"In the first French test I had 85%. Then the next test I had 88% and then the one I took the other, I had 94%! Would you believe it? (I was the highest, and the rest came in with 10%, 20%, 32%. Gee! what a bunch! Even our French teacher said that we’re the worst French I class that she ever taught.) Well, this is our Raymond High School as they call it. Just now, we’re having a four day Easter holiday. 23rd, 24th, 25th & 26th. This is only for the High School; the public school got off from 23rd to May 3rd, lucky things. The school van is still running, thank goodness. We were going to get a 2 ½ hour Easter exam (for each subject I mean) before the holiday but the teachers decided not to give it this year as we’re fairly behind in our school work. We’re all looking forward to the June Exam!!",Education
,"On April 21st we saw an Air Force Picture, brought by the Air Force Company from Ont. They are showing the picture all over the Prairie Provinces encouraging the girls to join the Women’s Air Force. It shows mainly what the girls do when they join up. It lasted for about two hours and it wasn’t bad at all. You haven’t by some chance seen it, have you?",WWII; Recreation
,"On April 3rd, all of our family went to see some a plays, dances, singing, etc. which lasted from 3:00 P.M. to 11:30 P.M. We had to take our lunches and had ½ hour off from 6:00-6:30 P.M. to eat it.",Recreation
,"The hall was just packed full; there were trucks from Picture Butte, Cardston, Coaldale, Stirling, etc. We had ride [sic] all the way home. Next morning I didn’t wake up till 11:00 A.M. Then on April 11th, we all went to a two feature Japanese show which lasted from 7:30 P.M. – 12:00 P.M. We had a ride home again all the way free. On April 14th, I went to the “Iceland” matinee after school with Teruko Ikeda. We got in for 15 ȼ. Did you see this picture? I thought it wasn’t as good as “Sun Valley Serenade” although “Iceland” had more skating in it.",Recreation
,"On April 17, the whole family went to Lethbridge C.P.R. station to meet our uncle & his family from Kaslo en route to Ontario. We last saw them on April 20th, 1942 when we left N.W. & we didn’t see them till almost a year. I was disgusted with them because they wouldn’t stay in Raymond. We had only 15 minutes to chat and bid farewell. Good thing it was on Sunday.",Forced-dispersal
,We’re all looking forward to the day when we sight the New Westminster station again.,Homesickness
,"Tomorrow, April 25th (Easter Sunday) the United Church decided to take a trip to some kind of a lake, about 36 miles from Raymond to pass the Easter Sunday. Well, they discovered that they couldn’t take us all as there won’t be enough room so only 2 from each family could go. Sad thing, we were waiting for this day. Only father and mother are",Recreation
,"going from our family. There’s only one chance out of ten when you find us all at home now a days [sic]. We’re nearing to our beet work again this year so we decided to go out when the weather is fine and before we get busy again. There are several places where beet seeds have been planted already. We haven’t got our seeds planted yet, but are expecting it in a short while. The field has been ploughed & ready to be planted.",Labour-conditions
,"This year it seems as though its [sic] going to be very hot. For the past few weeks, I’ve worn no overcoat but a ¾ jacket every day. We can’t compare it with the weather when we first came here. This year I think we’re going to have 25-27 acres of beets. Last year we had only 21 acres although we came for 25. Dad doesn’t want to do so much. We tell him that we could do at least 30 acres, but he won’t say “okay.” He keeps on saying that 25 acres is enough. Oh, well, its [sic] up to him,",Living-conditions; Labour-conditions
,"& so much the better I am sending you some pictures with this letter. Don’t you think its about time to do so? The’re [sic] not very good pictures, but when we do take some better ones, I will send you some even if its a year after.",Photographs
,"Well, I think this is all I have to say for now, and I’ll try to write sooner next time. In the meantime, I’ll be waiting for your sweet hand-writing to come. Very",Communications; Communications
,best regards to your father and mother and wish you the best of luck in future [sic].,
,"Love from a pal, Sumi.",
,"P.S.1. I just finished looking over your February 21st letter and you wanted to know how we were making out on ration cards. Well, as for sugar, we’re going swell. For butter, we get so far behind that many tickets have been thrown away. We use around two lbs. a week. We don’t buy any coffee at all. As for tea, we just can’t buy all the tickets worth. Only ones who drinks [sic] it are my mom, dad, Kay & myself very seldom. The rest drinks milk or cocoa.",WWII
,"P.S.2. Mother would be very glad if you could send some plants. She’s planning to have a flower garden this year & have already planted some poppy seeds. She doesn’t mind what kind of plants you send unless it won’t be such a bother to you. I’m sure she’d appreciate anything you can send. When we do go back to S.W. she said she’d take all the presents back, so if you want anything special, just say so in the letters. This is about the only way in which I can ever repay you. S.M.",Homesickness
,P.S. 3. Please overlook my errors and scribbling (AND HOW!!).,Communications
,"P.S. 4. I forgot all about the “Sadie Hawkin’s Day.” We had it last month for a month week. Some boys were dressed up as ladies and what beautiful ladies they seemed! (especially the legs.) Three of the tallest boys were on stilts which made them appear as a giant. The got a good kick of it. Almost every girls wore pigtails. This was the first time I’ve ever worn pigtails to school. Some sights!!!!! Enough said, I think!!!!! S.M.",Recreation; Education
,Raymond Hi-School.,Education
,The trees at the front of the school has [sic] been cut down. There are three cement walks leading into the front of the building. This picture shows only one in the centre. More rooms has [sic] been added at the farther side of the building. My home room is at the corner where the girl is standing all alone.,Education
Letter 7,"Box 167,",
,"Raymond,",
,Alberta.,
,July 18/43.,
,"My dearest Joan,",
,"It was a pleasure hearing from you after a long time. I was terribly worried if you had stopped corresponding with me, but I knew it couldn’t be true because you’re not the type of a girl who would so such things. Well, anyways, thanks a million for your ever-welcomed letter and I was certainly glad to hear from you again.",Joan; Communications
,"How is everybody in your family back home? Well, I hope, as we all are also.",
,"School’s over, and here I am at home. I stayed out almost three weeks from school on account of beet work and went back on the day before our June exams. That was June 18th, and the following week from Monday to Thursday I went to take my tests. So I got out of school on June 24th.",Education
,"Teruko (Yr. 8) got out on June 21st and went back on the 22nd to get her report card. My smallest sister, Marion, passed with honour, so she got out from school on June 16th. Lucky thing, she gets out the earliest and doesn’t have to do a bit of work in the beets. She’s just a spoiled kid in our family who never “grows up.” Gee, I was boiling mad the day I went back to school our health teacher gave us our Health Exam and I didn’t even glance over my notes. I still think it was her fault because Health Exam was scheduled on June 25th and I was expecting it on that date. I don’t know whether I passed or flunked in it (most likely flunked!) because we get our results mailed to us around middle of August from the Department of Education. On the same day we also got Home Ec. Exam and a little Soc. St. test. I don’t think I have to say much",Education
,"about that! All I have to say is that I fail my grade, I intend to quit school and go out working. Probably house-working in winter and farming in summer. That’s about all the work there is for girls out here. Well, I hope I passed (because I prayed to God about it) because I still want to continue with my schooling.",Education; Gender-dynamics; Labour-conditions
,"All in all, we did thirty-four acres of thinning beets this year, (we have only twenty-six acres of our own.) and about forty acres of hoeing beets. Dad helped us hoe about half of our beets and then he went to work for our boss. So the rest of the family – Kay, Teruko, Sam & myself finished our beets and did fourteen acres of a man’s down at Stirling. Mom did washings and cooking for the family, making lunches and caring for the house. Marion would stay all day at our boss’s and just come out to the field when its [sic] time to eat. She wouldn’t miss her share of the lunch for",Beet-farms; Labour-conditions
,"anything. This year, we worked shorter hours; from 6:00 A.M – 8:00 P.M. We were all really surprised to find ourselves working faster this year. Last year, we worked longer hours and did only around 1 ½ acres, while this year, we worked approximately three hours shorter and do almost three acres a day. It rained quite a bit this year, but not as much as last year.",Beet-farms; Labour-conditions
,"Whenever it rained, I stayed home and rested. Heck, who wants to go to school when they’re tired? If I did go to school, I’ll be sleeping during the classes.",Education
,"We finished our hoeing thinning on Friday, June 25th, one day after I finished my exams. We started on our hoeing on June 28, rested on 30th because it rained, & also on July 1st, (Stampede Day) and finished on July 8th. Last year, on July 8th we just finished our thinning beets. The weather plays a large part in our work, I’ll say.",Beet-farms; Labour-conditions
,"Gee, Joan, I wish you were with me or I with you. It’s a shame war can endure in this civilized",Homesickness; Joan; WWII
,"world, isn’t it? I hope we can meet all over again just once more in the near future.",Optimism
,"Dad has gone to the Church Service to-day [sic]. Since we came out here, I haven’t gone to a service but once. Back at the coast, we used to go to Sunday-School every week, but out here, it’s so inconvenient – no bus, or no tram to take. Walking nine miles (both ways) every Sunday over a gravel road is too far, so we stay at home and tune in a service over the radio. Sam takes his bike and goes to the Sunday-School in the morning and Dad takes the bike for the afternoon service. The could take turns between them, but the girls can’t, so we ordered another bike among us.",Recreation; communications
,"Dad is looking for a car which he wants to buy, ‘cause it’s too inconvenient from town and we don’t want to walk half mile [sic] to our beet field (one way) every day.",Labour-conditions
,Everybody in our family went to the Stampede so I tagged along,Recreation
,"with them. This year we went on the 1st instead of 2nd, so we saw the parade. For such a small town as Raymond the parade was really quite good. The stampede programme was same as every year and I didn’t enjoy the programme part, but otherwise I did. After the stampede we went to a Buck Jones’ picture. The theatre was so full they had to close the wicket for a while. I never saw such a crowd of people in Raymond since I came here. Streets were crowded and cafes were just packed full. To get an ice-cream cone, I had to wait approximately twenty to thirty minutes. There was [sic] at least 18,000 at the stampede. (so it says in the “Raymond Recorder.”) Lucky for us, we had a good chance and got a ride home it was around 10:00 P.M. when we arrived home. Next day we worked Fiddle-sticks! It seems to me that I get more tired when I",Recreation
,"rest instead of working steadily day after day. I believe it was on June 22nd, I wasn’t intending to go to Shirley Temple’s “Miss Annie Rooney” show, but I went anyways, in spite of the tests the day after. I had to refresh my memory by going to a show. Oh! my! I forgot! ……",Recreation
,"Congratulations, to you, Joan & I hope you find your next grade as simple as you did this term. Don’t worry, you’ll always pass your grade with the highest honour, and if you don’t, nobody will. But that’ll be the day! You’ve always did and always will! To me, you’re the brightest student in the whole school.",Joan
,Father will be starting on [sic] Mr. Jensen’s chicken-house tomorrow. Mr. Jensen is the manager of the Social Credit Bank in Raymond. Chicken-houses are a nuisance to him.,Farm-owners
,"He wants to build boats, the ones he was building back at the coast; but I’m afraid he won’t get any chance to build one out here on the prairies.",Homesickness
,"We decided to raise chickens, but we can’t as the hawks & weasels gets [sic] them. Then we decided to raise pigs, but we also find it a great problem to solve.",Living-conditions
,"I’m afraid, Joan, I can’t write such interesting letters as you could. There’s nothing interesting to write about, and even if there is, I can’t write it as you do. I guess I had better close as this letter will, no doubt, be boring you, so I will close with love and hoping to meet you very soon,",Communications; Optimism
,"I remain,",
,"Your affectionate friend,",
,Sumi.,
,P.S. Excuse me for the water blotches on the letter.,
,P.S. Please write soon as possible [sic].,
,P.S. Mother send her best regards to you and the rest of your family. Love – S.,
Letter 8,"Box 167,",
,"Raymond,",
,"Alta.,",
,Sept. 24/43.,
,"Dearest Joan,",
,"Just a sheet with few lines to say “Hello” and “How are you”. It’s been quite a long time since I’ve heard from you last, and I hope you are all well as we are also.",
,"I imagine you’re going to school every day and enjoying your everyday life. That’s swell!!! Life is very dull out here … no school, no play.",
,"Guess what??? It’s but topping season now. Think of us in the field pulling and topping beets while you’re doing your geometry, social studies, etc. will you Joan? And I’ll think of you having a wonderful time while I work. School begins sometimes in October this year. From Tuesday this week, we’ve been going to top beets every day (about two miles from here.) He comes for us about 7:30 A.M. and takes us home again around 7:00 P.M. This year",Beet-farms; Homescickness
,"we do around 1 ½ acres. We might do more when it comes to our beets because we’ll start earlier in the A.M. and quit later in the P.M. and also we’ll work twice as hard as what we’re doing now. This year we have 26 acres and I suppose it will take around 2 weeks and no later, I hope, as we don’t want to pull beets out of the snow. Last year, we finished just in time. The day after we finished, it snowed, but we still had to work in the snow as we did 3 acres of somebody else’s after ours.",
